<?xml version="1.0"?>
<xs:xschema xmlns:xs="http://www.w3.org/2001/XMLSchema">
  <xs:element name="Hotels">
    <xs:complexType>
      <xs:element name="Hotel" maxOccurs="unbounded">
        <xs:attribute name="Rating" type="xs:decimal"/>
        <xs:complexType>
          <xs:sequence>
            
            <xs:element name="Name" type="xs:string"/>
            <xs:element name="Phone" type="xs:string" maxOccurs="unbounded"/>
            
            <xs:element name="Address">
              <xs:attribute name="NearestAirport" type = "xs:string" use="required"/>
              <xs:complexType>
                <xs:sequence>
                  <xs:element name="Number" type="xs:integer"/>
                  <xs:element name="City" type="xs:string"/>
                  <xs:element name="State" type"xs:string"/>
                  <xs:element name="Zip" type"xs:integer"/>
                </xs:sequence>
              </xs:complexType>
              
            </xs:element>
          </xs:sequence>
        </xs:complexType>
      </xs:element>
    </xs:complexType>
  </xs:element>
</xs:xschema>
            
      
